{
  "schema_version": "1",
  "task_id": "STATE-INIT",
  "claimed_outcome": "candidate_ready",
  "summary": "SIMULATED fixture candidate",
  "changed_files": [
    "crates/raft-verified/src/node.rs"
  ],
  "attempted_obligation_ids": [],
  "commands_reported_by_agent": [],
  "proposed_spec_changes": [],
  "proposed_trust_changes": [],
  "blockers": []
}
